{
  "$schema": "https://json-schema.org/draft/2020-12/schema",
  "$id": "https://perfeng.dev/schemas/playwright-measurements/v1/playwright-measurements.schema.json",
  "$defs": {
    "id": {
      "type": "string",
      "description": "a string matching the pattern ^[a-z][a-z0-9]*(?:-[a-z0-9]+)*$",
      "pattern": "^[a-z][a-z0-9]*(?:-[a-z0-9]+)*$"
    },
    "version": {
      "type": "string",
      "description": "a string matching the pattern ^(0|[1-9][0-9]*)\\.(0|[1-9][0-9]*)\\.(0|[1-9][0-9]*)$",
      "pattern": "^(0|[1-9][0-9]*)\\.(0|[1-9][0-9]*)\\.(0|[1-9][0-9]*)$"
    },
    "sha256": {
      "type": "string",
      "description": "a string matching the pattern ^[a-f0-9]{64}$",
      "pattern": "^[a-f0-9]{64}$"
    },
    "timestamp": {
      "type": "string",
      "format": "date-time",
      "description": "a string matching the pattern ^\\d{4}-\\d{2}-\\d{2}T\\d{2}:\\d{2}:[0-5]\\d(?:\\.\\d{1,6})?(?:Z|[+-]\\d{2}:\\d{2})$",
      "pattern": "^\\d{4}-\\d{2}-\\d{2}T\\d{2}:\\d{2}:[0-5]\\d(?:\\.\\d{1,6})?(?:Z|[+-]\\d{2}:\\d{2})$"
    }
  },
  "type": "object",
  "required": [
    "schemaVersion",
    "kind",
    "runId",
    "testId",
    "workload",
    "runtime",
    "browser",
    "measurementWindow",
    "createdAt",
    "measurements",
    "scenario"
  ],
  "properties": {
    "schemaVersion": {
      "type": "number",
      "enum": [
        1
      ]
    },
    "kind": {
      "type": "string",
      "enum": [
        "PlaywrightMeasurements"
      ]
    },
    "runId": {
      "type": "string",
      "description": "Reference to the run metadata",
      "pattern": "^perf-[0-9]{8}-[0-9]{6}-[a-f0-9]{8}$"
    },
    "testId": {
      "$ref": "#/$defs/id"
    },
    "workload": {
      "type": "object",
      "required": [
        "id",
        "version",
        "profile",
        "sha256"
      ],
      "properties": {
        "id": {
          "$ref": "#/$defs/id"
        },
        "version": {
          "$ref": "#/$defs/version"
        },
        "profile": {
          "type": "string",
          "enum": [
            "smoke",
            "average",
            "regression",
            "stress",
            "capacity",
            "soak"
          ]
        },
        "sha256": {
          "$ref": "#/$defs/sha256"
        }
      },
      "additionalProperties": false
    },
    "runtime": {
      "type": "object",
      "required": [
        "playwrightVersion",
        "nodeVersion",
        "platform",
        "architecture"
      ],
      "properties": {
        "playwrightVersion": {
          "$ref": "#/$defs/version"
        },
        "nodeVersion": {
          "$ref": "#/$defs/version"
        },
        "platform": {
          "type": "string",
          "enum": [
            "linux",
            "darwin",
            "win32"
          ]
        },
        "architecture": {
          "type": "string",
          "enum": [
            "x64",
            "arm64"
          ]
        }
      },
      "additionalProperties": false
    },
    "browser": {
      "type": "object",
      "required": [
        "name",
        "version",
        "headless",
        "viewport",
        "deviceScaleFactor"
      ],
      "properties": {
        "name": {
          "type": "string",
          "enum": [
            "chromium",
            "firefox",
            "webkit"
          ]
        },
        "version": {
          "type": "string",
          "description": "a string matching the pattern ^[A-Za-z0-9][A-Za-z0-9._+-]{0,63}$",
          "pattern": "^[A-Za-z0-9][A-Za-z0-9._+-]{0,63}$"
        },
        "headless": {
          "type": "boolean"
        },
        "viewport": {
          "type": "object",
          "required": [
            "width",
            "height"
          ],
          "properties": {
            "width": {
              "type": "integer",
              "description": "a number greater than or equal to 1",
              "title": "greaterThanOrEqualTo(1)",
              "minimum": 1
            },
            "height": {
              "type": "integer",
              "description": "a number greater than or equal to 1",
              "title": "greaterThanOrEqualTo(1)",
              "minimum": 1
            }
          },
          "additionalProperties": false
        },
        "deviceScaleFactor": {
          "type": "number",
          "description": "a positive number",
          "title": "greaterThan(0)",
          "exclusiveMinimum": 0
        }
      },
      "additionalProperties": false
    },
    "measurementWindow": {
      "type": "object",
      "required": [
        "start",
        "end"
      ],
      "properties": {
        "start": {
          "$ref": "#/$defs/timestamp"
        },
        "end": {
          "$ref": "#/$defs/timestamp"
        }
      },
      "additionalProperties": false
    },
    "createdAt": {
      "$ref": "#/$defs/timestamp"
    },
    "measurements": {
      "type": "array",
      "items": {
        "type": "object",
        "required": [
          "iteration",
          "name",
          "durationMs"
        ],
        "properties": {
          "iteration": {
            "type": "integer",
            "description": "a number greater than or equal to 1",
            "title": "greaterThanOrEqualTo(1)",
            "minimum": 1
          },
          "name": {
            "type": "string",
            "description": "Metric name following naming convention",
            "title": "minLength(1)",
            "minLength": 1,
            "pattern": "^[a-z][a-z0-9_.]*$"
          },
          "durationMs": {
            "type": "number",
            "description": "a non-negative number",
            "title": "greaterThanOrEqualTo(0)",
            "minimum": 0
          }
        },
        "additionalProperties": false
      },
      "description": "an array of at least 1 item(s)",
      "title": "minItems(1)",
      "minItems": 1
    },
    "scenario": {
      "type": "object",
      "required": [
        "cacheProfile",
        "contextReuse",
        "warmupIterations",
        "measurementIterations"
      ],
      "properties": {
        "cacheProfile": {
          "type": "string",
          "enum": [
            "cold",
            "warm"
          ]
        },
        "contextReuse": {
          "type": "string",
          "enum": [
            "per-iteration",
            "per-run"
          ]
        },
        "warmupIterations": {
          "type": "integer",
          "description": "a non-negative number",
          "title": "greaterThanOrEqualTo(0)",
          "minimum": 0
        },
        "measurementIterations": {
          "type": "integer",
          "description": "a number greater than or equal to 1",
          "title": "greaterThanOrEqualTo(1)",
          "minimum": 1
        }
      },
      "additionalProperties": false,
      "allOf": [
        {
          "if": {
            "properties": {
              "cacheProfile": {
                "const": "cold"
              }
            }
          },
          "then": {
            "properties": {
              "contextReuse": {
                "const": "per-iteration"
              }
            }
          }
        },
        {
          "if": {
            "properties": {
              "cacheProfile": {
                "const": "warm"
              }
            }
          },
          "then": {
            "properties": {
              "contextReuse": {
                "const": "per-run"
              }
            }
          }
        }
      ]
    }
  },
  "additionalProperties": false,
  "title": "Playwright semantic measurements"
}
