{
  "schemaVersion": 1,
  "kind": "PlaywrightMeasurements",
  "runId": "perf-20260902-130000-a1b2c3d5",
  "testId": "search-browser",
  "workload": {
    "id": "search-browser-smoke",
    "version": "1.0.0",
    "profile": "smoke",
    "sha256": "dcbb9c0f92dc16917a24f7eb52c95689a2091f893b64ccb219246af51a7da3c7"
  },
  "scenario": {
    "cacheProfile": "warm",
    "contextReuse": "per-run",
    "warmupIterations": 2,
    "measurementIterations": 10
  },
  "runtime": {
    "playwrightVersion": "1.62.1",
    "nodeVersion": "24.18.0",
    "platform": "linux",
    "architecture": "x64"
  },
  "browser": {
    "name": "chromium",
    "version": "140.0.7339.16",
    "headless": true,
    "viewport": {
      "width": 1280,
      "height": 720
    },
    "deviceScaleFactor": 1
  },
  "measurementWindow": {
    "start": "2026-09-02T13:00:00Z",
    "end": "2026-09-02T13:01:00Z"
  },
  "createdAt": "2026-09-02T13:01:01Z",
  "measurements": [
    {"iteration": 1, "name": "ui.search.action_to_visible_ms", "durationMs": 130},
    {"iteration": 2, "name": "ui.search.action_to_visible_ms", "durationMs": 150},
    {"iteration": 3, "name": "ui.search.action_to_visible_ms", "durationMs": 142},
    {"iteration": 4, "name": "ui.search.action_to_visible_ms", "durationMs": 138},
    {"iteration": 5, "name": "ui.search.action_to_visible_ms", "durationMs": 145},
    {"iteration": 6, "name": "ui.search.action_to_visible_ms", "durationMs": 135},
    {"iteration": 7, "name": "ui.search.action_to_visible_ms", "durationMs": 148},
    {"iteration": 8, "name": "ui.search.action_to_visible_ms", "durationMs": 140},
    {"iteration": 9, "name": "ui.search.action_to_visible_ms", "durationMs": 137},
    {"iteration": 10, "name": "ui.search.action_to_visible_ms", "durationMs": 143}
  ]
}
